{
  "record_id": "IV-007",
  "source_record_id": "IV-007",
  "claim_or_result": "Neutralizing the mind/head system permanently prevents return to ordinary personality.",
  "verification_scope": "Independent review must distinguish author-defined or normative content from independently established fact and require an operational test where an empirical claim is made.",
  "evidence_refs": [
    "PENDING_INDEPENDENT_SOURCE"
  ],
  "independent_verifier": "PENDING_INDEPENDENT_REVIEW",
  "verification_method": "Independent review with evidence, counter-evidence, reproducibility/test requirements where applicable, reviewer provenance and audit. No automatic VERIFIED promotion.",
  "reviewed_at": "",
  "verification_state": "UNVERIFIED",
  "limitations": [
    "No independent evidence is currently recorded; the permanent causal claim requires substantial evidence.",
    "No VERIFIED promotion is permitted without complete independent review and audit."
  ]
}
