{
  "record_id": "IV-010",
  "source_record_id": "IV-010",
  "claim_or_result": "Nature, Earth, human civilization and living systems should be protected.",
  "verification_scope": "Independent review must distinguish author-defined or normative content from independently established fact and require an operational test where an empirical claim is made.",
  "evidence_refs": [
    "PENDING_INDEPENDENT_SOURCE"
  ],
  "independent_verifier": "PENDING_INDEPENDENT_REVIEW",
  "verification_method": "Independent review with evidence, counter-evidence, reproducibility/test requirements where applicable, reviewer provenance and audit. No automatic VERIFIED promotion.",
  "reviewed_at": "",
  "verification_state": "UNVERIFIED",
  "limitations": [
    "This is primarily a normative proposition; independent review has not been completed.",
    "No VERIFIED promotion is permitted without complete independent review and audit."
  ]
}
