{
  "record_id": "IV-009",
  "source_record_id": "IV-009",
  "claim_or_result": "The framework is billions/trillions of times superior to historical figures or existing knowledge systems.",
  "verification_scope": "Independent review must distinguish author-defined or normative content from independently established fact and require an operational test where an empirical claim is made.",
  "evidence_refs": [
    "PENDING_INDEPENDENT_SOURCE"
  ],
  "independent_verifier": "PENDING_INDEPENDENT_REVIEW",
  "verification_method": "Independent review with evidence, counter-evidence, reproducibility/test requirements where applicable, reviewer provenance and audit. No automatic VERIFIED promotion.",
  "reviewed_at": "",
  "verification_state": "UNVERIFIED",
  "limitations": [
    "No quantitative benchmark is currently recorded; the superiority magnitude remains unverified.",
    "No VERIFIED promotion is permitted without complete independent review and audit."
  ]
}
